{
  "id": "shells",
  "chapterId": "integral-applications",
  "number": "7.3",
  "title": "旋转体：圆柱壳",
  "subtitle": "绕一圈的窄条有多长？",
  "concept": "平行于旋转轴的窄条转一圈，形成薄圆柱壳。体积近似为$\\text{周长}\\times\\text{高度}\\times\\text{厚度}$。",
  "intuition": "把薄壳展开：长为 $2 \\pi  r$，高为 $h$，厚为 $\\mathrm{d}r$。因此一层贡献约 $2\\pi rh\\,\\mathrm{d}r$。",
  "objectives": [
    "建立壳的三个量",
    "为什么近似会准确",
    "与圆环法交叉检查"
  ],
  "body": [
    {
      "title": "半径、高度怎样找？",
      "text": "绕 $y$ 轴取竖条时，$r = x$，$h$=上−下。绕 $x = k$ 时，$r = |x - k|$。每层须对应不同半径，避免重叠计数。"
    },
    {
      "title": "为什么薄壳近似能用于积分？",
      "text": "精确体积为 $\\pi  [(r + \\Delta  r)^{2} - r^{2}] h$。展开得到 $2 \\pi  r h \\Delta  r + \\pi  h \\Delta  r^{2}$；细分后第二项消失，留下积分。"
    },
    {
      "title": "怎样核对结果？",
      "text": "同一区域改用圆环法，答案应相同。若旋转轴穿过区域，把两边壳层直接相加可能重复计算，要先选无重叠描述。"
    }
  ],
  "formalDefinition": {
    "text": "圆柱壳体积公式。",
    "latex": "V=2\\pi\\int_a^b r(x)h(x)dx",
    "conditions": [
      "$a < b$，半径 $r$ 与高度 $h$ 在 $[a , b]$ 连续且非负；壳层不能重复覆盖。",
      "切片平行旋转轴；$x$ 沿垂直于轴的方向计距离，使 $\\mathrm{d}x$ 是径向厚度。例如绕 $y$ 轴、$x \\ge 0$ 时 $r = x$。"
    ]
  },
  "derivation": [
    {
      "text": "对 $0 \\le x \\le 1$、$0 \\le y \\le x^{2}$ 绕 $y$ 轴。",
      "latex": "r=x,\\qquad h=x^2"
    },
    {
      "text": "微小壳体积为 $2 \\pi  x^{3} \\mathrm{d}x$。",
      "latex": "V=2\\pi\\int_0^1x^3dx"
    },
    {
      "text": "积分得到 $\\frac{\\pi }{2}$。",
      "latex": "V=\\frac\\pi2"
    }
  ],
  "interactiveVisual": {
    "kind": "shell",
    "function": "square",
    "caption": "移动竖条：半径 $x$、高 $x^{2}$、周长 $2 \\pi  x$；切片视图与旋转示意同步。",
    "prediction": "薄壳半径增加时，高度是否保持不变？对照二维竖片，找出 $2 \\pi  x$ 与 $x^{2}$。"
  },
  "workedExamples": [
    {
      "title": "壳层直接算",
      "problem": "区域 $0 \\le x \\le 2$、$0 \\le y \\le x$ 绕 $y$ 轴的体积。",
      "steps": [
        "$r = x$、$h = x$，因此 $V = 2 \\pi  \\int _{0}^{2} x^{2} \\mathrm{d}x$。",
        "得到 $\\frac{2 \\pi  \\times 8}{3}$。"
      ],
      "answer": "$\\frac{16\\pi}{3}$。"
    },
    {
      "title": "用圆环核对",
      "problem": "区域 $0 \\le x \\le 1$、$0 \\le y \\le x^{2}$ 绕 $y$ 轴旋转，改用圆环法核对体积。",
      "steps": [
        "横切 $y \\in [0 , 1]$，外半径 1，内半径 $\\sqrt{y}$。",
        "$V = \\pi  \\int _{0}^{1} (1 - y) \\mathrm{d}y = \\frac{\\pi }{2}$。"
      ],
      "answer": "与壳层结果 $\\frac{\\pi}{2}$ 一致。"
    }
  ],
  "commonMistakes": [
    {
      "id": "shells-m1",
      "claim": "把壳半径平方。",
      "correction": "薄壳使用周长 $2 \\pi  r$，只有圆盘面积使用 $\\pi  r^{2}$。"
    },
    {
      "id": "shells-m2",
      "claim": "跨轴两侧壳层直接相加。",
      "correction": "可能重复覆盖，要先画旋转后的区域。"
    }
  ],
  "practice": [
    {
      "id": "shells-p1",
      "difficulty": 1,
      "misconceptionTags": [
        "shells-m1"
      ],
      "problem": "区域 $0 \\le x \\le 1$、$0 \\le y \\le 1$ 绕 $y$ 轴的体积？",
      "answer": "$\\pi$。",
      "solution": [
        "壳法 $2 \\pi  \\int _{0}^{1} x \\mathrm{d}x = \\pi$。"
      ],
      "hint": "这是半径 1、高 1 的圆柱。"
    },
    {
      "id": "shells-p2",
      "difficulty": 2,
      "misconceptionTags": [
        "shells-m1"
      ],
      "problem": "$y = x$、$0 \\le x \\le 1$ 下方区域绕 $y$ 轴体积？",
      "answer": "$\\frac{2\\pi}{3}$。",
      "solution": [
        "$2 \\pi  \\int _{0}^{1} x \\cdot x \\mathrm{d}x = \\frac{2 \\pi }{3}$。"
      ],
      "hint": "半径与高度都为 $x$。"
    },
    {
      "id": "shells-p3",
      "difficulty": 1,
      "misconceptionTags": [],
      "problem": "竖条绕 $x = 3$ 旋转，$x \\in [0 , 1]$ 时半径是什么？",
      "answer": "$3-x$。",
      "solution": [
        "到竖直轴的水平距离为 $|x - 3| = 3 - x$。"
      ],
      "hint": "半径始终非负。"
    },
    {
      "id": "shells-p4",
      "difficulty": 2,
      "misconceptionTags": [],
      "problem": "壳公式中高度与厚度可以交换吗？",
      "answer": "不能随意交换。",
      "solution": [
        "高度沿轴，厚度沿半径；改变切法会改变积分变量与边界。"
      ],
      "hint": "先看三维几何方向。"
    }
  ],
  "prerequisites": [
    "disk-washer",
    "area-between"
  ],
  "difficulty": 4,
  "misconceptionTags": [
    "shells-m1",
    "shells-m2"
  ],
  "provenance": {
    "author": "AI-generated",
    "version": "0.3.1",
    "status": "revised",
    "humanReviewed": false
  },
  "sources": [
    "openstax-calculus-1",
    "active-calculus-2",
    "ies-learning",
    "phet-design"
  ],
  "learningCheck": {
    "question": "区域 $0 \\le y \\le x^{2}$、$0 \\le x \\le 1$ 绕 $y$ 轴旋转。半径 $x$ 的薄壳高度是多少？",
    "choices": [
      "$x$",
      "$x^{2}$",
      "$1 - x^{2}$"
    ],
    "correctIndex": 1,
    "explanation": "竖片从 $y = 0$ 延伸到 $y = x^{2}$，高是 $x^{2}$。薄壳体积约为 $2 \\pi  x \\cdot x^{2} \\cdot \\mathrm{d}x$。"
  },
  "teaching": {
    "explain": "平行于旋转轴的窄条扫成薄壳。壳的体积贡献是周长乘高度乘厚度；不能把周长误换成圆盘面积。",
    "steps": [
      {
        "title": "看较小半径",
        "instruction": "完成一圈，选中半径 0.25 的壳。",
        "preset": {
          "dimension": "3d",
          "degrees": 360,
          "slice": 0.25
        },
        "observation": "高度为 $\\frac1{16}$，周长为 $\\frac\\pi2$。"
      },
      {
        "title": "把半径加倍",
        "instruction": "选中半径 0.5 的壳。",
        "preset": {
          "dimension": "3d",
          "degrees": 360,
          "slice": 0.5
        },
        "observation": "高度变为四倍，周长变为两倍；每单位厚度的贡献变为八倍。"
      },
      {
        "title": "回到二维条带",
        "instruction": "在二维把位置设为 0.5。",
        "preset": {
          "dimension": "2d",
          "x": 0.5
        },
        "observation": "竖条高度是 $x^2$，半径是 $x$；两者在积分里分别出现。"
      }
    ]
  }
}
